{"catalogMagnet":"magnet:?xt=urn:btih:133c26cdf92da66e15d9948b9b43db73c90adbea&dn=catalog-00000009.json&tr=udp%3A%2F%2Ftracker.opentrackr.org%3A1337%2Fannounce&tr=udp%3A%2F%2Fopen.stealth.si%3A80%2Fannounce&ws=https%3A%2F%2Fferreiratechlab.github.io%2FKMP-catalog%2Fsnapshots%2Fcatalog-00000009.json&ws=https%3A%2F%2Fraw.githubusercontent.com%2FFerreiraTechLab%2FKMP-catalog%2Fmain%2Fdocs%2Fsnapshots%2Fcatalog-00000009.json","catalogSha256":"60a94c2ff1c59bd9690fb8afac5ba95d03ad8a5318723486146f7b5ccecedb8c","catalogSignature":"6gt5xlZoFg66JSTQvyV/rp5ib8Gn64Um1R2x7arWB8IgI4Pcj8uQ1kv+4p/xtDT6GLMQRjZMvOj70UXf5xPODw==","catalogSize":15309,"catalogTorrent":"ZDg6YW5ub3VuY2U0Mjp1ZHA6Ly90cmFja2VyLm9wZW50cmFja3Iub3JnOjEzMzcvYW5ub3VuY2UxMzphbm5vdW5jZS1saXN0bGw0Mjp1ZHA6Ly90cmFja2VyLm9wZW50cmFja3Iub3JnOjEzMzcvYW5ub3VuY2VlbDMzOnVkcDovL29wZW4uc3RlYWx0aC5zaTo4MC9hbm5vdW5jZWVlNDppbmZvZDY6bGVuZ3RoaTE1MzA5ZTQ6bmFtZTIxOmNhdGFsb2ctMDAwMDAwMDkuanNvbjEyOnBpZWNlIGxlbmd0aGkyNjIxNDRlNjpwaWVjZXMyMDoLHKToDTDRZWDMuz7ioJH3L3IRomU4OnVybC1saXN0bDc3Omh0dHBzOi8vZmVycmVpcmF0ZWNobGFiLmdpdGh1Yi5pby9LTVAtY2F0YWxvZy9zbmFwc2hvdHMvY2F0YWxvZy0wMDAwMDAwOS5qc29uMTAzOmh0dHBzOi8vcmF3LmdpdGh1YnVzZXJjb250ZW50LmNvbS9GZXJyZWlyYVRlY2hMYWIvS01QLWNhdGFsb2cvbWFpbi9kb2NzL3NuYXBzaG90cy9jYXRhbG9nLTAwMDAwMDA5Lmpzb25lZQ==","expiresAt":"2026-11-11T01:25:06Z","publishedAt":"2026-10-12T01:25:06Z","schemaVersion":1,"sequence":9}
